"article.title","journal.title","journal.volume","pageStart","pageEnd","publication.year","citation","abstract"
"Authoring Tools for Designing Intelligent Tutoring Systems: a Systematic Review of the Literature","International Journal of Artificial Intelligence in Education","volume28","336","384","2018","Dermeval, D., Paiva, R., Bittencourt, I. et al. Authoring Tools for Designing Intelligent Tutoring Systems: a Systematic Review of the Literature. Int J Artif Intell Educ 28, 336–384 (2018). https://doi.org/10.1007/s40593-017-0157-9","Authoring tools have been broadly used to design Intelligent Tutoring Systems (ITS). However, ITS community still lacks a current understanding of how authoring tools are used by non-programmer authors to design ITS. Hence, the objective of this work is to review how authoring tools have been supporting ITS design for non-programmer authors. In order to meet our goal, we conduct a Systematic Literature Review (SLR) to identify the primary studies on the use of ITS authoring tools, following a pre-defined review protocol. Among the 4622 papers retrieved from seven digital libraries published from 2009 to June 2016, 33 papers are finally included after applying our exclusion and inclusion criteria. We then identify the main ITS components authored, the ITS types designed, the features used to facilitate the authoring process, the technologies used to develop authoring tools and the time at which authoring occurs. We also look for evidence of the benefits of ITS authoring tools. In summary, the main findings of this work are: (1) there is empirical evidence of the benefits (i.e., mainly in terms of effectiveness, efficiency, quality of authored artifacts, and usability) of using ITS authoring tools for non-programmer authors, specially to aid authoring of learning content and to support authoring of model-tracing/cognitive and example-tracing tutors; 2) domain and pedagogical models have been much more targeted by authoring tools; (3) several ITS types have been authored, with an emphasis on model-tracing/cognitive and example-tracing tutors; (4) besides providing features for authoring all four ITS components, current authoring tools are also presenting general features (e.g., view learners’ statistics and reuse tutor design) to create broader authoring tools; (5) a great diversity of technologies, which include AI techniques, software solutions and distributed technologies, are used to develop ITS authoring tools; and (6) authoring tools have been mainly targeting ITS design before students’ instruction, but works are also addressing authoring during and/or post-instruction relying both on human and artificial intelligence. We conclude this work by showing several promising research opportunities that are quite important and interesting but underexplored in current research and practice."
"Preface: Special Issue on Multidisciplinary Approaches to AI and Education for Reading and Writing","International Journal of Artificial Intelligence in Education","volume27","665","670","2017","Passonneau, R.J., McNamara, D., Muresan, S. et al. Preface: Special Issue on Multidisciplinary Approaches to AI and Education for Reading and Writing. Int J Artif Intell Educ 27, 665–670 (2017). https://doi.org/10.1007/s40593-017-0158-8",""
"Going Global: Understanding English Language Learners’ Student Motivation in English-Language MOOCs","International Journal of Artificial Intelligence in Education","volume28","528","552","2018","Uchidiuno, J.O., Ogan, A., Yarzebinski, E. et al. Going Global: Understanding English Language Learners’ Student Motivation in English-Language MOOCs. Int J Artif Intell Educ 28, 528–552 (2018). https://doi.org/10.1007/s40593-017-0159-7","Massive Open Online Courses (MOOCs) offer high quality, free courses to anyone with an Internet connection. However, these courses may be relatively inaccessible to the large global population of students who are English Language Learners (ELLs). Current efforts to understand student motivation in MOOCs do not take into account the specific needs of ELL students. Through interviews with 12 ELL online students, and a survey with 20,084 ELL respondents, we investigate ELL students’ motivations for taking online courses. We show that ELL students’ motivations are highly socialized strategies for achieving long-term goals of economic, social, and geographic mobility. Although research studies show that ELLs interact sparingly with other students in MOOCs, we present evidence that they have unmet needs for interaction, and discuss how student interaction systems in MOOCs can better address these needs. Finally, we show evidence that ELLs deliberately use English MOOCs to improve their language skills, even when the content is not language-related. This implies that meeting ELL students’ needs and access to MOOCs involves translating MOOCs to their local languages, but also providing language support in English-language MOOCs."
"A Multimodal Analysis of Making","International Journal of Artificial Intelligence in Education","volume28","385","419","2018","Worsley, M., Blikstein, P. A Multimodal Analysis of Making. Int J Artif Intell Educ 28, 385–419 (2018). https://doi.org/10.1007/s40593-017-0160-1","This paper presents three multimodal learning analytic approaches from a hands-on learning activity. We use video, audio, gesture and bio-physiology data from a two-condition study (N = 20), to identify correlations between the multimodal data, experimental condition, and two learning outcomes: design quality and learning. The three approaches incorporate: 1) human-annotated coding of video data, 2) automated coding of gesture, audio and bio-physiological data and, 3) concatenated human-annotated and automatically annotated data. Within each analysis we employ the same machine learning and sequence mining techniques. Ultimately we find that each approach provides different affordances depending on the similarity metric and the dependent variable. For example, the analysis based on human-annotated data found strong correlations among multimodal behaviors, experimental condition, success and learning, when we relaxed constraints on temporal similarity. The second approach performed well when comparing students’ multimodal behaviors as a time series, but was less effective using the temporally relaxed similarity metric. The take-away is that there are several strategies for doing multimodal learning analytics, and that many of these approaches can provide a meaningful glimpse into a complex data set, glimpses that may be difficult to identify using traditional approaches."
"The Civic Mission of MOOCs: Engagement across Political Differences in Online Forums","International Journal of Artificial Intelligence in Education","volume28","553","589","2018","Yeomans, M., Stewart, B.M., Mavon, K. et al. The Civic Mission of MOOCs: Engagement across Political Differences in Online Forums. Int J Artif Intell Educ 28, 553–589 (2018). https://doi.org/10.1007/s40593-017-0161-0","Massive open online courses (MOOCs) attract diverse student bodies, and course forums could potentially be an opportunity for students with different political beliefs to engage with one another. We test whether this engagement actually takes place in two politically-themed MOOCs, on education policy and American government. We collect measures of students’ political ideology, and then observe student behavior in the course discussion boards. Contrary to the common expectation that online spaces often become echo chambers or ideological silos, we find that students in these two political courses hold diverse political beliefs, participate equitably in forum discussions, directly engage (through replies and upvotes) with students holding opposing beliefs, and converge on a shared language rather than talking past one another. Research that focuses on the civic mission of MOOCs helps ensure that open online learning engages the same breadth of purposes that higher education aspires to serve."
"Scaling Academic Writing Instruction: Evaluation of a Scaffolding Tool (Thesis Writer)","International Journal of Artificial Intelligence in Education","volume28","590","615","2018","Rapp, C., Kauf, P. Scaling Academic Writing Instruction: Evaluation of a Scaffolding Tool (Thesis Writer). Int J Artif Intell Educ 28, 590–615 (2018). https://doi.org/10.1007/s40593-017-0162-z","No thesis - no graduation. Academic writing poses manifold challenges to students, instructors and institutions alike. High labor costs, increasing student numbers, and the Bologna Process (which has reduced the period after which undergraduates in Europe submit their first thesis and thus the time available to focus on writing skills) all pose a threat to students’ academic writing abilities. This situation gave rise to the practical goal of this study: to determine if, and to what extent, academic writing and its instruction can be scaled (i.e., designed more efficiently) using a technological solution, in this case Thesis Writer (TW), a domain-specific, online learning environment for the scaffolding of student academic writing, combined with an online editor optimized for producing academic text. Compared to existing automated essay scoring and writing evaluation tools, TW is not focusing on feedback but on instruction, planning, and genre mastery. While most US-based tools, particularly those also used in secondary education, are targeting on the essay genre, TW is tailored to the needs of theses and research article writing (IMRD scheme). This mixed-methods paper reports data of a test run with a first-year course of 102 business administration students. A technology adoption model served as a frame of reference for the research design. From a student’s perspective, problems posed by the task of writing a research proposal as well as the use, usability, and usefulness of TW were studied through an online survey and focus groups (explanatory sequential design). Results seen were positive to highly positive – TW is being used, and has been deemed supportive by students. In particular, it supports the scaling of writing instruction in group assignment settings."
"Automated Test Assembly for Handling Learner Cold-Start in Large-Scale Assessments","International Journal of Artificial Intelligence in Education","volume28","616","631","2018","Vie, J., Popineau, F., Bruillard, É. et al. Automated Test Assembly for Handling Learner Cold-Start in Large-Scale Assessments. Int J Artif Intell Educ 28, 616–631 (2018). https://doi.org/10.1007/s40593-017-0163-y","In large-scale assessments such as the ones encountered in MOOCs, a lot of usage data is available because of the number of learners involved. Newcomers, that just arrive on a MOOC, have various backgrounds in terms of knowledge, but the platform hardly knows anything about them. Therefore, it is crucial to elicit their knowledge fast, in order to personalize their learning experience. Such a problem has been called learner cold-start. We present in this article an algorithm for sampling a group of initial, diverse questions for a newcomer, based on a method recently used in machine learning: determinantal point processes. We show, using real data, that our method outperforms existing techniques such as uncertainty sampling, and can provide useful feedback to the learner over their strong and weak points."
"Ontology-Based Generation of Medical, Multi-term MCQs","International Journal of Artificial Intelligence in Education","volume29","145","188","2019","Leo, J., Kurdi, G., Matentzoglu, N. et al. Ontology-Based Generation of Medical, Multi-term MCQs. Int J Artif Intell Educ 29, 145–188 (2019). https://doi.org/10.1007/s40593-018-00172-w","Designing good multiple choice questions (MCQs) for education and assessment is time consuming and error-prone. An abundance of structured and semi-structured data has led to the development of automatic MCQ generation methods. Recently, ontologies have emerged as powerful tools to enable the automatic generation of MCQs. However, current question generation approaches focus on knowledge recall questions. In addition, questions that have so far been generated are, compared to manually created ones, simple and cover only a small subset of the required question complexity space in the education and assessment domain. In this paper, we focus on addressing the limitations of previous approaches by generating questions with complex stems that are suitable for scenarios beyond mere knowledge recall. We present a novel ontology-based approach that exploits classes and existential restrictions to generate case-based questions. Our contribution lies in: (1) the specification of procedure for generating case-based questions which involve (a) assembling complex stems, (b) selecting suitable options, and (c) providing explanations for option correctness/incorrectness, (2) an implementation of the procedure using a medical ontology and (3) and evaluation of our generation technique to test question quality and their suitability in practise. We implement our approach as an application for a medical education scenario on top of a large knowledge base in the medical domain. We generate more than 3 million questions for four physician specialities and evaluate our approach in a user study with 15 medical experts. We find that using a stratified random sample of 435 questions out of which 316 were rated by two experts, 129 (30%) are considered appropriate to be used in exams by both experts and a further 216 (50%) by at least one expert."
"Inferring Students’ Personality from Their Communication Behavior in Web-based Learning Systems","International Journal of Artificial Intelligence in Education","volume29","189","216","2019","Wu, W., Chen, L., Yang, Q. et al. Inferring Students’ Personality from Their Communication Behavior in Web-based Learning Systems. Int J Artif Intell Educ 29, 189–216 (2019). https://doi.org/10.1007/s40593-018-00173-9","Communication tools have been popular in web-based learning systems because of their ability to promote the interaction and potentially alleviate the high dropout issue. In recent years, with the increased awareness among researchers about the individual difference of the students, more and more personalized learning supports have been developed. Although personality has been considered as a valuable personal factor being incorporated into the provision of personalized learning, existing studies mainly acquire students’ personality via questionnaires, which unavoidably demands user efforts. In this paper, we are motivated to derive students’ Big-Five personality from their communication behavior in web-based learning systems. Concretely, we first identify a set of features that are significantly influenced by students’ personality, which not only include their communication activities carried out in both synchronous and asynchronous web-based learning environment, but also their linguistic content in conversational texts. We then develop inference model to unify these features for determining students’ five personality traits, and find that students’ usage of different communication tools can be effective in predicting their Big-Five personality."
"Metacognitive Overload!: Positive and Negative Effects of Metacognitive Prompts in an Intelligent Tutoring System","International Journal of Artificial Intelligence in Education","volume28","420","438","2018","McCarthy, K.S., Likens, A.D., Johnson, A.M. et al. Metacognitive Overload!: Positive and Negative Effects of Metacognitive Prompts in an Intelligent Tutoring System. Int J Artif Intell Educ 28, 420–438 (2018). https://doi.org/10.1007/s40593-018-0164-5","Research suggests that promoting metacognitive awareness can increase performance in, and learning from, intelligent tutoring systems (ITSs). The current work examines the effects of two metacognitive prompts within iSTART, a reading comprehension strategy ITS in which students practice writing quality self-explanations. In addition to comparing iSTART practice to a no-training control, those in the iSTART condition (n<U+2009>=<U+2009>116) were randomly assigned to a 2 (performance threshold: off, on)<U+2009>×<U+2009>2(self-assessment: off, on) design. The performance threshold notified students when their average self-explanation score was below an experimenter-set threshold and the self-assessment prompted students to estimate their self-explanation score on the current trial. Students who practiced with iSTART had higher posttest self-explanation scores and inference comprehension scores on a transfer test than students in the no training control, replicating previous benefits for iSTART. However, there were no effects of either metacognitive prompt on these learning outcomes. In-system self-explanation scores indicated that the metacognitive prompts were detrimental to performance relative to standard iSTART practice. This study did not find benefits of metacognitive prompts in enhancing performance during practice or after the completion of training. Such findings support the idea that improving reading comprehension strategies comes from deliberate practice with actionable feedback rather than explicit metacognitive supports."
"How Does Prior Knowledge Influence Eye Fixations and Sequences of Cognitive and Metacognitive SRL Processes during Learning with an Intelligent Tutoring System?","International Journal of Artificial Intelligence in Education","volume29","1","28","2019","Taub, M., Azevedo, R. How Does Prior Knowledge Influence Eye Fixations and Sequences of Cognitive and Metacognitive SRL Processes during Learning with an Intelligent Tutoring System?. Int J Artif Intell Educ 29, 1–28 (2019). https://doi.org/10.1007/s40593-018-0165-4","The goal of this study was to use eye-tracking and log-file data to investigate the impact of prior knowledge on college students’ (N<U+2009>=<U+2009>194, with a subset of n<U+2009>=<U+2009>30 for eye tracking and sequence mining analyses) fixations on (i.e., looking at) self-regulated learning-related areas of interest (i.e., specific locations on the interface) and on the sequences of engaging in cognitive and metacognitive self-regulated learning processes during learning with MetaTutor, an Intelligent Tutoring System that teaches students about the human circulatory system. Results revealed that there were no significant differences in fixations on single areas of interest by the prior knowledge group students were assigned to; however there were significant differences in fixations on pairs of areas of interest, as evidenced by eye-tracking data. Furthermore, there were significant differences in sequential patterns of engaging in cognitive and metacognitive self-regulated learning processes by students’ prior knowledge group, as evidenced from log-file data. Specifically, students with high prior knowledge engaged in processes containing cognitive strategies and metacognitive strategies whereas students with low prior knowledge did not. These results have implications for designing adaptive intelligent tutoring systems that provide individualized scaffolding and feedback based on individual differences, such as levels of prior knowledge."
"Effects of Voice-Based Synthetic Assistant on Performance of Emergency Care Provider in Training","International Journal of Artificial Intelligence in Education","volume29","122","143","2019","Damacharla, P., Dhakal, P., Stumbo, S. et al. Effects of Voice-Based Synthetic Assistant on Performance of Emergency Care Provider in Training. Int J Artif Intell Educ 29, 122–143 (2019). https://doi.org/10.1007/s40593-018-0166-3","As part of a perennial project, our team is actively engaged in developing new synthetic assistant (SA) technologies to assist in training combat medics and medical first responders. It is critical that medical first responders are well trained to deal with emergencies more effectively. This would require real-time monitoring and feedback for each trainee. Therefore, we introduced a voice-based SA to augment the training process of medical first responders and enhance their performance in the field. The potential benefits of SAs include a reduction in training costs and enhanced monitoring mechanisms. Despite the increased usage of voice-based personal assistants (PAs) in day-to-day life, the associated effects are commonly neglected for a study of human factors. Therefore, this paper focuses on performance analysis of the developed voice-based SA in emergency care provider training for a selected emergency treatment scenario. The research discussed in this paper follows design science in developing proposed technology; at length, we discussed architecture and development and presented working results of voice-based SA. The empirical testing was conducted on two groups as user studies using statistical analysis tools, one trained with conventional methods and the other with the help of SA. The statistical results demonstrated the amplification in training efficacy and performance of medical responders powered by SA. Furthermore, the paper also discusses the accuracy and time of task execution (t) and concludes with the guidelines for resolving the identified problems."
"Instructing a Teachable Agent with Low or High Self-Efficacy – Does Similarity Attract?","International Journal of Artificial Intelligence in Education","volume29","89","121","2019","Tärning, B., Silvervarg, A., Gulz, A. et al. Instructing a Teachable Agent with Low or High Self-Efficacy – Does Similarity Attract?. Int J Artif Intell Educ 29, 89–121 (2019). https://doi.org/10.1007/s40593-018-0167-2","This study examines the effects of teachable agents’ expressed self-efficacy on students. A total of 166 students, 10- to 11-years-old, used a teachable agent-based math game focusing on the base-ten number system. By means of data logging and questionnaires, the study compared the effects of high vs. low agent self-efficacy on the students’ in-game performance, their own math self-efficacy, and their attitude towards their agent. The study further explored the effects of matching vs. mismatching between student and agent with respect to self-efficacy. Overall, students who interacted with an agent with low self-efficacy performed better than students interacting with an agent with high self-efficacy. This was especially apparent for students who had reported low self-efficacy themselves, who performed on par with students with high self-efficacy when interacting with a digital tutee with low self-efficacy. Furthermore, students with low self-efficacy significantly increased their self-efficacy in the matched condition, i.e. when instructing a teachable agent with low self-efficacy. They also increased their self-efficacy when instructing a teachable agent with high self-efficacy, but to a smaller extent and not significantly. For students with high self-efficacy, a potential corresponding effect on a self-efficacy change due to matching may be hidden behind a ceiling effect. As a preliminary conclusion, on the basis of the results of this study, we propose that teachable agents should preferably be designed to have low self-efficacy."
"Personalizing Algebra to Students’ Individual Interests in an Intelligent Tutoring System: Moderators of Impact","International Journal of Artificial Intelligence in Education","volume29","58","88","2019","Walkington, C., Bernacki, M.L. Personalizing Algebra to Students’ Individual Interests in an Intelligent Tutoring System: Moderators of Impact. Int J Artif Intell Educ 29, 58–88 (2019). https://doi.org/10.1007/s40593-018-0168-1","Students experience mathematics in their day-to-day lives as they pursue their individual interests in areas like sports or video games. The present study explores how connecting to students’ individual interests can be used to personalize learning using an Intelligent Tutoring System (ITS) for algebra. We examine the idea that the effects of personalization may be moderated by students’ depth of quantitative engagement with their out-of-school interests. We also examine whether math problems designed to draw upon students’ knowledge of their individual interests at a deep level (i.e., actual quantitative experiences) or surface level (i.e., superficial changes to problem topic) have differential effects. Results suggest that connecting math instruction to students’ out-of-school interests can be beneficial for learning in an ITS and reduces gaming the system. However, benefits may only be realized when students’ degree of quantitative engagement with their out-of-school interests matches the depth at which the personalized problems are written. Students whose quantitative engagement with their interests is minimal may benefit most when problems draw upon superficial aspects of their interest areas. Students who report significant quantitative engagement with their interests may benefit most when individual interests are deeply incorporated into the quantitative structure of math problems. We also find that problems with deeper personalization may spur positive affective states and ward off negative ones for all students. Findings suggest depth is a critical feature of personalized learning with implications for theory and AI instructional design."
