"article.title","journal.title","journal.volume","pageStart","pageEnd","publication.year","citation","abstract"
"Shifting the Load: a Peer Dialogue Agent that Encourages its Human Collaborator to Contribute More to Problem Solving","International Journal of Artificial Intelligence in Education","volume27","101","129","2017","Howard, C., Jordan, P., Di Eugenio, B. et al. Shifting the Load: a Peer Dialogue Agent that Encourages its Human Collaborator to Contribute More to Problem Solving. Int J Artif Intell Educ 27, 101–129 (2017). https://doi.org/10.1007/s40593-015-0071-y","Despite a growing need for educational tools that support students at the earliest phases of undergraduate Computer Science (CS) curricula, relatively few such tools exist–the majority being Intelligent Tutoring Systems. Since peer interactions more readily give rise to challenges and negotiations, another way in which students can become more interactive during problem solving, we created an artificial peer collaborator to determine its value for aiding CS students. Central to its development was the notion that it should monitor the student’s collaborative behavior and attempt to guide him/her towards more productive behavior. In prior work, we found that initiative shifts correlate with both Knowledge Co-Construction (KCC) and learning and are potentially easier to model as an indicator of productive collaboration in instructional software. In this paper, we describe a unique peer dialogue agent that we created to test the effects of tracking and reacting to initiative shifts. While our study did not find differences in learning gains when comparing agents that do and do not track and react to initiative shifts, we did find that students do learn when interacting with the agent and that attempting to influence initiative taking did make a difference. This suggests that by tracking initiative shifts, the agent was able to detect times when the student had been letting the agent do most of the “deep thinking” and that the agent’s tactics for encouraging the student to begin taking the initiative again were helpful."
"Commentary on: “Toward Computer-Based Support of MetaCognitive Skills: a Computational Framework to Coach Self Explanation”","International Journal of Artificial Intelligence in Education","volume26","183","192","2016","Conati, C. Commentary on: “Toward Computer-Based Support of MetaCognitive Skills: a Computational Framework to Coach Self Explanation”. Int J Artif Intell Educ 26, 183–192 (2016). https://doi.org/10.1007/s40593-015-0074-8","This paper is a commentary on “Toward Computer-Based Support of Meta-Cognitive Skills: a Computational Framework to Coach Self-Explanation”, by Cristina Conati and Kurt Vanlehn, published in the IJAED in 2000 (Conati and VanLehn 2010). This work was one of the first examples of Intelligent Learning Environments (ILE) that target activities beyond problem solving doing so by providing adaptive support to apply relevant domain independent meta-cognitive skills, as opposed to targeting domain-dependent knowledge. We provide an overview of the SE-Coach, the ILE presented in (Conati and Vanlehn 2000), in terms of underlying motivation, objectives, appeach and contibutions. This overview is followed by a discussion of subsequent developments in research on providing intelligent, student-adaptive support to meta-cognition, as well as of remaining open issues and avenues for future research."
"Coordinating the Complexity of Tools, Tasks, and Users: On Theory-based Approaches to Authoring Tool Usability","International Journal of Artificial Intelligence in Education","volume26","37","71","2016","Murray, T. Coordinating the Complexity of Tools, Tasks, and Users: On Theory-based Approaches to Authoring Tool Usability. Int J Artif Intell Educ 26, 37–71 (2016). https://doi.org/10.1007/s40593-015-0076-6","Intelligent Tutoring Systems authoring tools are highly complex educational software applications used to produce highly complex software applications (i.e. ITSs). How should our assumptions about the target users (authors) impact the design of authoring tools? In this article I first reflect on the factors leading to my original 1999 article on the state of the art in ITS authoring tools and consider some challenges facing authoring tool researchers today. Then, in the bulk of the paper, I propose some principled foundations for future authoring tool design, focusing on operationalizing the construct of complexity—for tool, task, and user. ITS authoring tools are major undertakings and to redeem this investment it is important to anticipate actual user needs and capacities. I propose that one way to do this is to match the complexity of tool design to the complexity of authoring tasks and the complexity capacity of users and user communities. Doing so entails estimating the complexity of the mental models that a user is expected to build in order to use a tool as intended. The goal is not so much to support the design of more powerful authoring tools as it is to design tools that meet the needs of realistic user audiences. This paper presents some exploratory ideas on how to operationalize the concept of complexity for tool, task, and user. The paper draws from the following theories and frameworks to weave this narrative: Complexity Science, Activity Theory, Epistemic Forms and Games, and adult cognitive developmental theory (Hierarchical Complexity Theory). This exploration of usability and complexity is applicable to the design of any type of complex authoring application, though the application area that motivated the exploration is ITS authoring."
"Using Ontological Engineering to Overcome AI-ED Problems: Contribution, Impact and Perspectives","International Journal of Artificial Intelligence in Education","volume26","91","106","2016","Mizoguchi, R., Bourdeau, J. Using Ontological Engineering to Overcome AI-ED Problems: Contribution, Impact and Perspectives. Int J Artif Intell Educ 26, 91–106 (2016). https://doi.org/10.1007/s40593-015-0077-5","This article reflects on the ontology engineering methodology discussed by the paper entitled “Using Ontological Engineering to Overcome AI-ED Problems” published in this journal in 2000. We discuss the achievements obtained in the last 10 years, the impact of our work as well as recent trends and perspectives in ontology engineering for AIED."
"The SIETTE Automatic Assessment Environment","International Journal of Artificial Intelligence in Education","volume26","270","292","2016","Conejo, R., Guzmán, E. & Trella, M. The SIETTE Automatic Assessment Environment. Int J Artif Intell Educ 26, 270–292 (2016). https://doi.org/10.1007/s40593-015-0078-4","This article describes the evolution and current state of the domain-independent Siette assessment environment. Siette supports different assessment methods—including classical test theory, item response theory, and computer adaptive testing—and integrates them with multidimensional student models used by intelligent educational systems. Teachers can use an authoring tool to create large item pools of different types of questions, including multiple choice, open answer, generative questions, and complex tasks. Siette can be used for formative and summative assessment and incorporates different learning elements, including scaffolding features, such as hints, feedback, and misconceptions. It includes numerous other features covering different educational needs and techniques, such as spaced repetition, collaborative testing, or pervasive learning. Siette is designed as a web-based assessment component that can be semantically integrated with intelligent systems or with large LMSs, such as Moodle. This article reviews the evolution of the Siette system, presents information on its use, and analyses this information from a broader and critical perspective on the use of intelligent systems in education."
"Lab4CE: a Remote Laboratory for Computer Education","International Journal of Artificial Intelligence in Education","volume27","154","180","2017","Broisin, J., Venant, R. & Vidal, P. Lab4CE: a Remote Laboratory for Computer Education. Int J Artif Intell Educ 27, 154–180 (2017). https://doi.org/10.1007/s40593-015-0079-3","Remote practical activities have been demonstrated to be efficient when learners come to acquire inquiry skills. In computer science education, virtualization technologies are gaining popularity as this technological advance enables instructors to implement realistic practical learning activities, and learners to engage in authentic and problem-based learning. However, virtualization solutions have not been designed especially for education and do not address any pedagogical concern. Since several large-scale studies showed that instructional supports during practical activities are almost as important as technical features, this article investigates the following research question: how the scaffolding around the lab increases students’ engagement in remote practical learning of computer science? To answer this question, we introduce the Lab4CE environment, a remote laboratory for computer education which adopts a distributed, modular and flexible architecture to integrate a set of scaffolding tools and services intended for instructors and learners. An exploratory study conducted with 139 undergraduate students enrolled in the first year of a computer science degree suggests a positive effect of the framework on learners’ engagement when they come to practice system administration, and reveals a significant positive correlation between students’ activity within the system and students’ learning achievement."
"Ask-Elle: an Adaptable Programming Tutor for Haskell Giving Automated Feedback","International Journal of Artificial Intelligence in Education","volume27","65","100","2017","Gerdes, A., Heeren, B., Jeuring, J. et al. Ask-Elle: an Adaptable Programming Tutor for Haskell Giving Automated Feedback. Int J Artif Intell Educ 27, 65–100 (2017). https://doi.org/10.1007/s40593-015-0080-x","Ask-Elle is a tutor for learning the higher-order, strongly-typed functional programming language Haskell. It supports the stepwise development of Haskell programs by verifying the correctness of incomplete programs, and by providing hints. Programming exercises are added to Ask-Elle by providing a task description for the exercise, one or more model solutions, and properties that a solution should satisfy. The properties and model solutions can be annotated with feedback messages, and the amount of flexibility that is allowed in student solutions can be adjusted. The main contribution of our work is the design of a tutor that combines (1) the incremental development of different solutions in various forms to a programming exercise with (2) automated feedback and (3) teacher-specified programming exercises, solutions, and properties. The main functionality is obtained by means of strategy-based model tracing and property-based testing. We have tested the feasibility of our approach in several experiments, in which we analyse both intermediate and final student solutions to programming exercises, amongst others."
"Interaction with an Edu-Game: A Detailed Analysis of Student Emotions and Judges’ Perceptions","International Journal of Artificial Intelligence in Education","volume26","975","1010","2016","Conati, C., Gutica, M. Interaction with an Edu-Game: A Detailed Analysis of Student Emotions and Judges’ Perceptions. Int J Artif Intell Educ 26, 975–1010 (2016). https://doi.org/10.1007/s40593-015-0081-9","We present the results of a study that explored the emotions experienced by students during interaction with an educational game for math (Heroes of Math Island). Starting from emotion frameworks in affective computing and education, we considered a larger set of emotions than in related research. For emotion labeling, we started from a standard methodology that relies on trained judges to report emotions over 20-s intervals, however, we asked judges to report all observed emotions in each interval, as opposed to only choosing one, as is standard practice. This variation allows us to discuss the appropriateness of this interval for emotion labeling. We present a detailed analysis of interrater reliability, both aggregated and over individual students, that considers not only labeling agreement among judges in terms of emotion type, but also with respect to the number of emotions detected. We also provide an analysis based on in-depth one-to-one interviews with judges, to gain insights on the challenges they encountered in labeling emotions."
"An Interview Reflection on “Intelligent Tutoring Goes to School in the Big City”","International Journal of Artificial Intelligence in Education","volume26","13","24","2016","Koedinger, K.R., Aleven, V. An Interview Reflection on “Intelligent Tutoring Goes to School in the Big City”. Int J Artif Intell Educ 26, 13–24 (2016). https://doi.org/10.1007/s40593-015-0082-8","Our 1997 article in IJAIED reported on a study that showed that a new algebra curriculum with an embedded intelligent tutoring system (the Algebra Cognitive Tutor) dramatically enhanced high-school students’ learning. The main motivation for the study was to demonstrate that intelligent tutors that have cognitive science research embedded in them could have real impact in schools. This study was one of the first large-scale classroom evaluations of the integrated use of an Intelligent Tutoring System (ITS) in high schools. A core challenge was figuring out how to embed this new technology into a curriculum and into the existing social context of schools. A key element of the study design was to include multiple kinds of assessments, including standardized test items and items measuring complex problem solving and use of representations. The results were powerful: “On average the 470 students in experimental classes outperformed students in comparison classes by 15 % on standardized tests and 100 % on tests targeting the [course] objectives.” We suggested that the study was evidence “that laboratory tutoring systems can be scaled up and made to work, both technically and pedagogically, in real and unforgiving settings like urban high schools.” Since this study, many more classroom studies comparing instruction that includes an ITS against business as usual have been conducted, often showing advantages for the ITS-enhanced curricula. More rigorous randomized field trials are now more commonplace, but the approach of using multiple assessments in large-scale randomized field trials has not caught on. Cognitive task analysis will remain fundamental to the success of ITSs. A key remaining question for ITS is to find out how they can be used most effectively to support open-ended problem solving, either online or offline. Given all the recent excitement around Massive Open Online Courses (MOOCs), it is interesting to note that our field of Artificial Intelligence in Education has been making huge, less recognized, progress with impact on millions of students and with the majority of those students finishing the course!"
"Taking Control: Stealth Assessment of Deterministic Behaviors Within a Game-Based System","International Journal of Artificial Intelligence in Education","volume26","1011","1032","2016","Snow, E.L., Likens, A.D., Allen, L.K. et al. Taking Control: Stealth Assessment of Deterministic Behaviors Within a Game-Based System. Int J Artif Intell Educ 26, 1011–1032 (2016). https://doi.org/10.1007/s40593-015-0085-5","Game-based environments frequently afford students the opportunity to exert agency over their learning paths by making various choices within the environment. The combination of log data from these systems and dynamic methodologies may serve as a stealth means to assess how students behave (i.e., deterministic or random) within these learning environments. The current work captures variations in students’ behavior patterns by employing two dynamic analyses to classify students’ sequences of choices within an adaptive learning environment. Random Walk analyses and Hurst exponents were used to classify students’ interaction patterns as random or deterministic. Forty high school students interacted with the game-based system, iSTART-ME, for 11-sessions (pretest, 8 training sessions, posttest, and a delayed retention test). Analyses revealed that students who interacted in a more deterministic manner also generated higher quality self-explanations during training sessions. The results point toward the potential for dynamic analyses such as random walk analyses and Hurst exponents to provide stealth assessments of students’ learning behaviors while engaged within a game-based environment."
"Conversations with AutoTutor Help Students Learn","International Journal of Artificial Intelligence in Education","volume26","124","132","2016","Graesser, A.C. Conversations with AutoTutor Help Students Learn. Int J Artif Intell Educ 26, 124–132 (2016). https://doi.org/10.1007/s40593-015-0086-4","AutoTutor helps students learn by holding a conversation in natural language. AutoTutor is adaptive to the learners’ actions, verbal contributions, and in some systems their emotions. Many of AutoTutor’s conversation patterns simulate human tutoring, but other patterns implement ideal pedagogies that open the door to computer tutors eclipsing human tutors in learning gains. Indeed, current versions of AutoTutor yield learning gains on par with novice and expert human tutors. This article selectively highlights the status of AutoTutor’s dialogue moves, learning gains, implementation challenges, differences between human and ideal tutors, and some of the systems that evolved from AutoTutor. Current and future AutoTutor projects are investigating three-party conversations, called trialogues, where two agents (such as a tutor and student) interact with the human learner."
"Example-Tracing Tutors: Intelligent Tutor Development for Non-programmers","International Journal of Artificial Intelligence in Education","volume26","224","269","2016","Aleven, V., McLaren, B.M., Sewall, J. et al. Example-Tracing Tutors: Intelligent Tutor Development for Non-programmers. Int J Artif Intell Educ 26, 224–269 (2016). https://doi.org/10.1007/s40593-015-0088-2","In 2009, we reported on a new Intelligent Tutoring Systems (ITS) technology, example-tracing tutors, that can be built without programming using the Cognitive Tutor Authoring Tools (CTAT). Creating example-tracing tutors was shown to be 4–8 times as cost-effective as estimates for ITS development from the literature. Since 2009, CTAT and its associated learning management system, the Tutorshop, have been extended and have been used for both research and real-world instruction. As evidence that example-tracing tutors are an effective and mature ITS paradigm, CTAT-built tutors have been used by approximately 44,000 students and account for 40 % of the data sets in DataShop, a large open repository for educational technology data sets. We review 18 example-tracing tutors built since 2009, which have been shown to be effective in helping students learn in real educational settings, often with large pre/post effect sizes. These tutors support a variety of pedagogical approaches, beyond step-based problem solving, including collaborative learning, educational games, and guided invention activities. CTAT and other ITS authoring tools illustrate that non-programmer approaches to building ITS are viable and useful and will likely play a key role in making ITS widespread."
"Help Helps, But Only So Much: Research on Help Seeking with Intelligent Tutoring Systems","International Journal of Artificial Intelligence in Education","volume26","205","223","2016","Aleven, V., Roll, I., McLaren, B.M. et al. Help Helps, But Only So Much: Research on Help Seeking with Intelligent Tutoring Systems. Int J Artif Intell Educ 26, 205–223 (2016). https://doi.org/10.1007/s40593-015-0089-1","Help seeking is an important process in self-regulated learning (SRL). It may influence learning with intelligent tutoring systems (ITSs), because many ITSs provide help, often at the student’s request. The Help Tutor was a tutor agent that gave in-context, real-time feedback on students’ help-seeking behavior, as they were learning with an ITS. Key goals were to help students become better self-regulated learners and help them achieve better domain-level learning outcomes. In a classroom study, feedback on help seeking helped students to use on-demand help more deliberately, even after the feedback was no longer given, but not to achieve better learning outcomes. The work made a number of contributions, including the creation of a knowledge-engineered, rule-based, executable model of help seeking that can drive tutoring. We review these contributions from a contemporary perspective, with a theoretical analysis, a review of recent empirical literature on help seeking with ITSs, and methodological suggestions. Although we do not view on-demand, principle-based help during tutored problem solving as being as important as we once did, we still view it as helpful under certain circumstances, and recommend that it be included in ITSs. We view the goal of helping students become better self-regulated learners as one of the grand challenges in ITSs research today."
"Do You Think You Can? The Influence of Student Self-Efficacy on the Effectiveness of Tutorial Dialogue for Computer Science","International Journal of Artificial Intelligence in Education","volume27","130","153","2017","Wiggins, J.B., Grafsgaard, J.F., Boyer, K.E. et al. Do You Think You Can? The Influence of Student Self-Efficacy on the Effectiveness of Tutorial Dialogue for Computer Science. Int J Artif Intell Educ 27, 130–153 (2017). https://doi.org/10.1007/s40593-015-0091-7","In recent years, significant advances have been made in intelligent tutoring systems, and these advances hold great promise for adaptively supporting computer science (CS) learning. In particular, tutorial dialogue systems that engage students in natural language dialogue can create rich, adaptive interactions. A promising approach to increasing the effectiveness of these systems is to adapt not only to problem-solving performance, but also to a student’s characteristics. Self-efficacy refers to a student’s view of her ability to complete learning objectives and to achieve goals; this characteristic may be particularly influential during tutorial dialogue for computer science education. This article examines a corpus of effective human tutoring for computer science to discover the extent to which considering self-efficacy as measured within a pre-survey, coupled with dialogue and task events during tutoring, improves models that predict the student’s self-reported frustration and learning gains after tutoring. The analysis reveals that students with high and low self-efficacy benefit differently from tutorial dialogue. Student control, social dialogue, and tutor moves to increase efficiency, may be particularly helpful for high self-efficacy students, while for low self-efficacy students, guided experimentation may foster greater learning while at the same time potentially increasing frustration. It is hoped that this line of research will enable tutoring systems for computer science to tailor their tutorial interactions more effectively."
