"article.title","journal.title","journal.volume","pageStart","pageEnd","publication.year","citation","abstract"
"Evolution Is not enough: Revolutionizing Current Learning Environments to Smart Learning Environments","International Journal of Artificial Intelligence in Education","volume26","561","581","2016","Kinshuk, Chen, N., Cheng, I. et al. Evolution Is not enough: Revolutionizing Current Learning Environments to Smart Learning Environments. Int J Artif Intell Educ 26, 561–581 (2016). https://doi.org/10.1007/s40593-016-0108-x","Advances in technology in recent years have changed the learning behaviors of learners and reshaped teaching methods. This had resulted in several challenges faced by current educational systems, such as an increased focus on informal learning, a growing gap of prior knowledge among students in classrooms and a mismatch between individual career choices and the development of the work force. This paper looks at these challenges with a view towards revolutionizing current learning environments to smart learning environments and provides new suggestions for technological solutions. Furthermore, this paper argues for a transformation from the current learning environments to smart learning environments. This is to be achieved by reengineering the fundamental structure and operations of current educational systems to better integrate these new technologies with the required pedagogical shift. The future perspectives of smart learning environments are reviewed and shared, through examples of emerging innovations such as the flipped classroom, game based learning, gesture based learning, along with pedagogical shifts, such as life-long learning portfolio maintenance, team teaching, and separation of learning and competency assessment."
"Preface to the IJAIED 25th Anniversary Issue, Part 2","International Journal of Artificial Intelligence in Education","volume26","539","543","2016","Lane, H.C., McCalla, G., Looi, C. et al. Preface to the IJAIED 25th Anniversary Issue, Part 2. Int J Artif Intell Educ 26, 539–543 (2016). https://doi.org/10.1007/s40593-016-0109-9",""
"Evolution and Revolution in Artificial Intelligence in Education","International Journal of Artificial Intelligence in Education","volume26","582","599","2016","Roll, I., Wylie, R. Evolution and Revolution in Artificial Intelligence in Education. Int J Artif Intell Educ 26, 582–599 (2016). https://doi.org/10.1007/s40593-016-0110-3","The field of Artificial Intelligence in Education (AIED) has undergone significant developments over the last twenty-five years. As we reflect on our past and shape our future, we ask two main questions: What are our major strengths? And, what new opportunities lay on the horizon? We analyse 47 papers from three years in the history of the Journal of AIED (1994, 2004, and 2014) to identify the foci and typical scenarios that occupy the field of AIED. We use those results to suggest two parallel strands of research that need to take place in order to impact education in the next 25 years: One is an evolutionary process, focusing on current classroom practices, collaborating with teachers, and diversifying technologies and domains. The other is a revolutionary process where we argue for embedding our technologies within students’ everyday lives, supporting their cultures, practices, goals, and communities."
"ToTCompute: A Novel EEG-Based TimeOnTask Threshold Computation Mechanism for Engagement Modelling and Monitoring","International Journal of Artificial Intelligence in Education","volume26","821","854","2016","Ghergulescu, I., Muntean, C.H. ToTCompute: A Novel EEG-Based TimeOnTask Threshold Computation Mechanism for Engagement Modelling and Monitoring. Int J Artif Intell Educ 26, 821–854 (2016). https://doi.org/10.1007/s40593-016-0111-2","Engagement influences participation, progression and retention in game-based e-learning (GBeL). Therefore, GBeL systems should engage the players in order to support them to maximize their learning outcomes, and provide the players with adequate feedback to maintain their motivation. Innovative engagement monitoring solutions based on players’ behaviour are needed to enable engagement monitoring in a non-disturbing way, without interrupting the game-play and game flow. Furthermore, generic metrics and automatic mechanisms for their engagement monitoring and modelling are needed. One important metric that was used for engagement modelling is TimeOnTask, which represents the duration of time required by the player to complete a task. This paper proposes ToTCompute (TimeOnTask Threshold Computation), a novel mechanism that automatically computes - in a task-dependent manner - TimeOnTask threshold values after which student engagement decreases with a given percentage from his initial level of engagement (e.g., after 2 min student engagement will fall with 10 % from his initial level). In this way the mechanism enables engagement modelling at a higher granularity and further enables engagement-based adaptation in GBeL systems. ToTCompute makes use of game-playing information and EEG signals collected through an initial testing session. The results of an experimental case study have shown that ToTCompute can be used to automatically compute threshold values for the TimeOnTask generic engagement metric, which explains up to 76.2 % of the variance in engagement change. Furthermore, the results confirmed the usefulness of the mechanism as the TimeOnTask threshold value is highly task-dependent, and setting its value manually for multiple game tasks would be a laborious process."
"Evolution of an Intelligent Deductive Logic Tutor Using Data-Driven Elements","International Journal of Artificial Intelligence in Education","volume27","5","36","2017","Mostafavi, B., Barnes, T. Evolution of an Intelligent Deductive Logic Tutor Using Data-Driven Elements. Int J Artif Intell Educ 27, 5–36 (2017). https://doi.org/10.1007/s40593-016-0112-1","Deductive logic is essential to a complete understanding of computer science concepts, and is thus fundamental to computer science education. Intelligent tutoring systems with individualized instruction have been shown to increase learning gains. We seek to improve the way deductive logic is taught in computer science by developing an intelligent, data-driven logic tutor. We have augmented Deep Thought, an existing computer-based logic tutor, by adding data-driven methods, specifically; intelligent problem selection based on the student’s current proficiency, automatically generated on-demand hints, and determination of student problem solving strategies based on clustering previous students. As a result, student tutor completion (the amount of the tutor the students completed) steadily improved as data-driven methods were added to Deep Thought, allowing students to be exposed to more logic concepts. We also gained additional insights into the effects of different course work and teaching methods on tutor effectiveness."
"An Analysis of Student Model Portability","International Journal of Artificial Intelligence in Education","volume26","932","974","2016","Valdés Aguirre, B., Ramírez Uresti, J.A. & Boulay, B.d. An Analysis of Student Model Portability. Int J Artif Intell Educ 26, 932–974 (2016). https://doi.org/10.1007/s40593-016-0113-0","Sharing user information between systems is an area of interest for every field involving personalization. Recommender Systems are more advanced in this aspect than Intelligent Tutoring Systems (ITSs) and Intelligent Learning Environments (ILEs). A reason for this is that the user models of Intelligent Tutoring Systems and Intelligent Learning Environments, i.e. their student models, tend to be more heterogeneous and complex than traditional models used in Recommender Systems. To share and reuse student models we must first understand the restrictions for porting or reusing student models in new ITSs or ILEs. This paper proposes a classification of student models in terms of their portability. Portability is measured via each model’s accessibility, complexity, architecture, popularity, and description. We use this classification to analyse and then grade student models that have been published in the AIED, EDM and ITS research communities in 2013 and 2014. The classification is intended to be used by researchers both as a methodology to measure the portability of a student model and as a guide to find existing reusable models."
"Preface to Special Issue on User Modelling to Support Personalization in Enhanced Educational Settings","International Journal of Artificial Intelligence in Education","volume26","809","820","2016","Santos, O.C., Kravcik, M. & Boticario, J.G. Preface to Special Issue on User Modelling to Support Personalization in Enhanced Educational Settings. Int J Artif Intell Educ 26, 809–820 (2016). https://doi.org/10.1007/s40593-016-0114-z","Personalization approaches in learning environments aim to foster effective, active, efficient, and satisfactory learning. Suitable user modelling techniques are crucial to support these approaches in dealing with learners’ needs within realistic learning environments, which are currently cropping up in a varied range of situations. Bearing this in mind, this paper provides an overview of relevant research over the last five years in both user modelling and education, which shows an increasing interest among researchers and practitioners who are concerned with modelling users’ needs in the new and evolving educational settings that are widening the diversity of learning contexts and issues to be considered. In particular, we have identified three main areas of research: i) modelling of learners and their performance to provide engaging learning experiences, ii) designing adaptive support, and iii) building standards-based models to cope with interoperability and portability."
"Argumentation Scheme-Based Argument Generation to Support Feedback in Educational Argument Modeling Systems","International Journal of Artificial Intelligence in Education","volume27","515","533","2017","Green, N.L. Argumentation Scheme-Based Argument Generation to Support Feedback in Educational Argument Modeling Systems. Int J Artif Intell Educ 27, 515–533 (2017). https://doi.org/10.1007/s40593-016-0115-y","This paper describes an educational argument modeling system, GAIL (Genetics Argumentation Inquiry Learning). Using GAIL’s graphical interface, learners can select from possible argument content elements (hypotheses, data, etc.) displayed on the screen with which to construct argument diagrams. Unlike previous systems, GAIL uses domain-independent argumentation schemes to generate expert arguments as a knowledge source. By comparing the learner’s argument diagram to a generated argument, GAIL can provide problem-specific feedback on both the structure and meaning of the learner’s argument, e.g., that the learner’s argument contains an irrelevant premise. To generate arguments, the argumentation schemes are instantiated from causal domain models specified by lesson authors. Thus, this approach to generating expert arguments has the potential to be used in other domains. In this paper we describe use of GAIL’s Authoring Tool to create the domain model and content elements to be provided for a specific lesson, how expert arguments are generated in GAIL, and how the feedback is produced. As GAIL is a work-in-progress, the paper also describes plans for the next design iteration."
"An Educational System for Learning Search Algorithms and Automatically Assessing Student Performance","International Journal of Artificial Intelligence in Education","volume27","207","240","2017","Grivokostopoulou, F., Perikos, I. & Hatzilygeroudis, I. An Educational System for Learning Search Algorithms and Automatically Assessing Student Performance. Int J Artif Intell Educ 27, 207–240 (2017). https://doi.org/10.1007/s40593-016-0116-x","In this paper, first we present an educational system that assists students in learning and tutors in teaching search algorithms, an artificial intelligence topic. Learning is achieved through a wide range of learning activities. Algorithm visualizations demonstrate the operational functionality of algorithms according to the principles of active learning. So, a visualization process can stop and request from a student to specify the next step or explain the way that a decision was made by the algorithm. Similarly, interactive exercises assist students in learning to apply algorithms in a step-by-step interactive way. Students can apply an algorithm to an example case, specifying the algorithm’s steps interactively, with the system’s guidance and help, when necessary. Next, we present assessment approaches integrated in the system that aim to assist tutors in assessing the performance of students, reduce their marking task workload and provide immediate and meaningful feedback to students. Automatic assessment is achieved in four stages, which constitute a general assessment framework. First, the system calculates the similarity between the student’s and the correct answer using the edit distance metric. In the next stage, it identifies the type of the answer, based on an introduced answer categorization scheme related to completeness and accuracy of an answer, taking into account student carelessness too. Afterwards, the types of errors are identified, based on an introduced error categorization scheme. Finally, answer is automatically marked via an automated marker, based on its type, the edit distance and the type of errors made. To assess the learning effectiveness of the system an extended evaluation study was conducted in real class conditions. The experiment showed very encouraging results. Furthermore, to evaluate the performance of the assessment system, we compared the assessment mechanism against expert (human) tutors. A total of 400 students’ answers were assessed by three tutors and the results showed a very good agreement between the automatic assessment system and the tutors."
"A New Perspective of Negotiation-Based Dialog to Enhance Metacognitive Skills in the Context of Open Learner Models","International Journal of Artificial Intelligence in Education","volume26","1069","1115","2016","Suleman, R.M., Mizoguchi, R. & Ikeda, M. A New Perspective of Negotiation-Based Dialog to Enhance Metacognitive Skills in the Context of Open Learner Models. Int J Artif Intell Educ 26, 1069–1115 (2016). https://doi.org/10.1007/s40593-016-0118-8","Negotiation mechanism using conversational agents (chatbots) has been used in Open Learner Models (OLM) to enhance learner model accuracy and provide opportunities for learner reflection. Using chatbots that allow for natural language discussions has shown positive learning gains in students. Traditional OLMs assume a learner to be able to manage their own learning and already in an appropriate affective/behavioral state that is conducive for learning. This paper proposes a new perspective of learning that advances the state of the art in fully-negotiated OLMs by exploiting learner’s affective & behavioral states to generate engaging natural language dialogues that train them to enhance their metacognitive skills. In order to achieve this, we have developed the NDLtutor that provides a natural language interface to learners. Our system generates context-aware dialogues automatically to enhance learner participation and reflection. This paper provides details on the design and implementation of the NDLtutor and discusses two evaluation studies. The first evaluation study focuses on the dialogue management capabilities of our system and demonstrates that our dialog system works satisfactorily to realize meaningful and natural interactions for negotiation. The second evaluation study investigates the effects of our system on the self-assessment and self-reflection of the learners. The results of the evaluations show that the NDLtutor is able to produce significant improvements in the self-assessment accuracy of the learners and also provides adequate support for prompting self-reflection in learners."
"Designing Academic Writing Analytics for Civil Law Student Self-Assessment","International Journal of Artificial Intelligence in Education","volume28","1","28","2018","Knight, S., Buckingham Shum, S., Ryan, P. et al. Designing Academic Writing Analytics for Civil Law Student Self-Assessment. Int J Artif Intell Educ 28, 1–28 (2018). https://doi.org/10.1007/s40593-016-0121-0","Research into the teaching and assessment of student writing shows that many students find academic writing a challenge to learn, with legal writing no exception. Improving the availability and quality of timely formative feedback is an important aim. However, the time-consuming nature of assessing writing makes it impractical for instructors to provide rapid, detailed feedback on hundreds of draft texts which might be improved prior to submission. This paper describes the design of a natural language processing (NLP) tool to provide such support. We report progress in the development of a web application called AWA (Academic Writing Analytics), which has been piloted in a Civil Law degree. We describe: the underlying NLP platform and the participatory design process through which the law academic and analytics team tested and refined an existing rhetorical parser for the discipline; the user interface design and evaluation process; and feedback from students, which was broadly positive, but also identifies important issues to address. We discuss how our approach is positioned in relation to concerns regarding automated essay grading, and ways in which AWA might provide more actionable feedback to students. We conclude by considering how this design process addresses the challenge of making explicit to learners and educators the underlying mode of action in analytic devices such as our rhetorical parser, which we term algorithmic accountability."
"Assessing Text-Based Writing of Low-Skilled College Students","International Journal of Artificial Intelligence in Education","volume28","56","78","2018","Perin, D., Lauterbach, M. Assessing Text-Based Writing of Low-Skilled College Students. Int J Artif Intell Educ 28, 56–78 (2018). https://doi.org/10.1007/s40593-016-0122-z","The problem of poor writing skills at the postsecondary level is a large and troubling one. This study investigated the writing skills of low-skilled adults attending college developmental education courses by determining whether variables from an automated scoring system were predictive of human scores on writing quality rubrics. The human-scored measures were a holistic quality rating for a persuasive essay and an analytic quality score for a written summary. Both writing samples were based on text on psychology and sociology topics related to content taught at the introductory undergraduate level. The study is a modified replication of McNamara et al. (Written Communication, 27(1), 57–86 2010), who identified several Coh-Metrix variables from five linguistic classes that reliably predicted group membership (high versus low proficiency) using human quality scores on persuasive essays written by average-achieving college students. When discriminant analyses and ANOVAs failed to replicate the McNamara et al. (Written Communication, 27(1), 57–86 2010) findings, the current study proceeded to analyze all of the variables in the five Coh-Metrix classes. This larger analysis identified 10 variables that predicted human-scored writing proficiency. Essay and summary scores were predicted by different automated variables. Implications for instruction and future use of automated scoring to understand the writing of low-skilled adults are discussed."
"Preface for the Special Issue on AI-Supported Education in Computer Science","International Journal of Artificial Intelligence in Education","volume27","1","4","2017","Barnes, T., Boyer, K., Hsiao, S.I. et al. Preface for the Special Issue on AI-Supported Education in Computer Science. Int J Artif Intell Educ 27, 1–4 (2017). https://doi.org/10.1007/s40593-016-0123-y",""
"Computing of Learner’s Personality Traits Based on Digital Annotations","International Journal of Artificial Intelligence in Education","volume27","241","267","2017","Omheni, N., Kalboussi, A., Mazhoud, O. et al. Computing of Learner’s Personality Traits Based on Digital Annotations. Int J Artif Intell Educ 27, 241–267 (2017). https://doi.org/10.1007/s40593-016-0124-x","Researchers in education are interested in modeling of learner’s profile and adapt their learning experiences accordingly. When learners read and interact with their reading materials, they do unconscious practices like annotations which may be, a key feature of their personalities. Annotation activity requires readers to be active, to think critically and to analyze what has been drawn up, and to make explicit annotations in the margins of the text. Readers make annotation traces through underlining, highlighting, scribbling comments, summarizing, asking questions, expressing confusion or ambiguity, and evaluating the reading content. In this paper, we present a semi-automatic approach to building learners’ personality profiles based on their annotation traces yielded during an active reading session. The experimental results show the system’s efficiency to measure, with reasonable accuracy, the scores of a learner’s conscientiousness and neurotics traits."
"Designing Crowdcritique Systems for Formative Feedback","International Journal of Artificial Intelligence in Education","volume27","623","663","2017","Easterday, M.W., Rees Lewis, D. & Gerber, E.M. Designing Crowdcritique Systems for Formative Feedback. Int J Artif Intell Educ 27, 623–663 (2017). https://doi.org/10.1007/s40593-016-0125-9","Intelligent tutors based on expert systems often struggle to provide formative feedback on complex, ill-defined problems where answers are unknown. Hybrid crowdsourcing systems that combine the intelligence of multiple novices in face-to-face settings might provide an alternate approach for providing intelligent formative feedback. The purpose of this study was to develop empirically grounded design principles for crowdcritique systems that provide intelligent formative feedback on complex, ill-defined problems. In this design research project, we iteratively developed and tested a crowdcritique system through 3 studies of 43 novice problem solvers in 3 formal and informal learning environments. We collected observations, interviews, and surveys and used a grounded theory approach to develop and test socio-technical design principles for crowdcritique systems. The project found that to provide formative feedback on ill-defined problems, crowdcritique systems should provide a combination of technical features including: quick invite tools; formative framing; a public, near-synchronous social media interface; critique scaffolds; “like” system; community hashtags; analysis tools and “to do” lists; along with social practices including: prep/write-first/write-last script and critique training. Such a system creates a dual-channel conversation that increases the volume of quality critique by grounding comments, scaffolding and recording critique, and reducing production blocking. Such a design provides the benefits of both face-to-face critique and computer-support in both formal and informal learning environments while reducing the orchestration burden on instructors."
"Developing Emotion-Aware, Advanced Learning Technologies: A Taxonomy of Approaches and Features","International Journal of Artificial Intelligence in Education","volume27","268","297","2017","Harley, J.M., Lajoie, S.P., Frasson, C. et al. Developing Emotion-Aware, Advanced Learning Technologies: A Taxonomy of Approaches and Features. Int J Artif Intell Educ 27, 268–297 (2017). https://doi.org/10.1007/s40593-016-0126-8","A growing body of work on intelligent tutoring systems, affective computing, and artificial intelligence in education is exploring creative, technology-driven approaches to enhance learners’ experience of adaptive, positively-valenced emotions while interacting with advanced learning technologies. Despite this, there has been no published work to date that captures this topic’s breadth. We took up this grand challenge by integrating related empirical studies and existing conceptual work and proposing a theoretically-guided taxonomy for the development and improvement of emotion-aware systems. In particular, multiple strategies system developers may use to help learners experience positive emotions are mapped out, including those that require different amounts and types of information about the user, as well as when this information is required. Examples from the literature are provided to illustrate how different emotion-aware system approaches can be combined to take advantage of different types of data, both prior to and during the learner-system interaction. High-level system features that emotion-aware systems can tailor to learners in order to elicit positive emotions are also described and exemplified. Theoretically, the taxonomy is primarily informed by the control-value theory of achievement emotions (Pekrun 2006, 2011) and its assumptions about the relationship between distal and proximal antecedents and the elicitation and regulation of emotion. The taxonomy expands upon a dichotomy of emotion-aware systems proposed by D’Mello and Graesser (2015) and is intended to guide the design of emotion-aware systems that can foster positive emotions during learner-system interactions through the use of varied approaches, data sources, and design features."
